{
  "schemaVersion": "1.0",
  "requestGuid": "6f1c2b0e-8d4a-4c1e-9a53-2f0c7d9e4b11",
  "requestNo": "FL-000455",
  "submittedBy": "peter.bjerre@example.com",
  "submittedOn": "2026-09-24T12:00:00Z",
  "generatedAt": "2026-09-24T12:00:00Z",
  "source": "functional-location-canvas-app",
  "rows": [
    {
      "rowNo": 1,
      "functionalLocation": "SSV10 LAC10AB001 -B01",
      "description": "Tryktransmitter",
      "kksType": "KKS",
      "assignedClass": "GIV",
      "status": "valid",
      "blockingIssues": [],
      "warnings": [],
      "spoolValues": [
        {
          "field": "OPERATING PRESSURE",
          "value": "16"
        },
        {
          "field": "OPERATING PRESSURE UOM",
          "value": "Bar"
        },
        {
          "field": "EX-MARKING",
          "value": "Ex d"
        },
        {
          "field": "TRM ASSIGNMENT",
          "value": "X"
        },
        {
          "field": "ABC INDIC.",
          "value": "A"
        }
      ]
    },
    {
      "rowNo": 2,
      "functionalLocation": "SSV10 UAB10UE001FP",
      "description": "Brandgennemfoering",
      "kksType": "KKS",
      "assignedClass": "MKP",
      "status": "valid",
      "blockingIssues": [],
      "warnings": [],
      "spoolValues": [
        {
          "field": "FIRE CLASSIFICATION",
          "value": "BK EI 60 (60 min)"
        },
        {
          "field": "FIRE SEALING TYPE",
          "value": "Brandplade"
        },
        {
          "field": "FIRE SEALING PRODUCT",
          "value": "Hilti CP 611A"
        },
        {
          "field": "TRM ASSIGNMENT",
          "value": "X"
        },
        {
          "field": "ABC INDIC.",
          "value": "A"
        }
      ]
    },
    {
      "rowNo": 3,
      "functionalLocation": "SSV10 LAC10AB001 KA1",
      "description": "Ventil",
      "kksType": "KKS",
      "assignedClass": "MKP_VA",
      "status": "warning",
      "blockingIssues": [],
      "warnings": [
        "Legacy format."
      ],
      "spoolValues": []
    }
  ],
  "classBuckets": [
    {
      "className": "GIV",
      "functionalLocations": [
        "SSV10 LAC10AB001 -B01"
      ]
    },
    {
      "className": "MKP",
      "functionalLocations": [
        "SSV10 UAB10UE001FP"
      ]
    },
    {
      "className": "MKP_VA",
      "functionalLocations": [
        "SSV10 LAC10AB001 KA1"
      ]
    }
  ],
  "ruleMeta": {
    "componentCount": 139,
    "aggregateCount": 146,
    "functionKeyCount": 6441,
    "ruleSource": "html/app-functional-location.js + html/fl-rule-engine.js"
  }
}